key,title,summary,activityType,startDate,endDate,moreInfo,draftMode,key:enrolment
activity-01,"T","S","THEORY",2022/03/22 11:00, 2022/03/22 16:00, null,true,enrolment-01
activity-02,"Esto es una prueba para comprobar el numero maximo de caracteres disponible","Esto es una prueba para comprobar el numero maximo de caracteres disponible para el atributo summary","BALANCED",2022/07/14 10:00, 2022/07/15 12:00,https://direccionprueba.es,true,enrolment-02
activity-03,"Esto es una prueba","Esto es una prueba","THEORY",2021/9/07 18:00, 2021/9/07 22:12,null,true,enrolment-03
activity-04,"Texto con la mitad de caracteres title","Texto con la mitad de caracteres para el summary..","HANDS_ON",2021/03/21 16:28, 2021/03/22 14:12,https://yahoo.com,true,enrolment-04
activity-05,"Esto es un texto de prueba lo suficientemente largo","Esto es un texto de prueba lo suficientemente largo","BALANCED",2021/04/19 17:23, 2021/04/19 19:23,null,true,enrolment-05
activity-06,"Esto es un texto de prueba lo suficientemente largo","Esto es un texto de prueba lo suficientemente largo","BALANCED",2021/04/19 17:23, 2021/04/19 19:23,null,true,enrolment-10
activity-07,"Esto es un texto de prueba lo suficientemente largo","Esto es un texto de prueba lo suficientemente largo","BALANCED",2021/04/19 17:23, 2021/04/19 19:23,null,false,enrolment-10
activity-08,"Esto es un texto de prueba ","Esto es un texto de prueba","BALANCED",2021/04/19 17:23, 2021/04/19 19:23,null,true,enrolment-10
